<?xml version="1.0" encoding="UTF-8"?>
<!ELEMENT SQL (jdbcDriver+)>
<!ELEMENT jdbcDriver (statement+)>
<!ELEMENT statement (id, text)>
<!ELEMENT id (#PCDATA)>
<!ELEMENT text (#PCDATA)>
<!ATTLIST jdbcDriver Type  CDATA #REQUIRED>
